{
  "contract_version": "0.0.0",
  "declared_deployment_class": "A_RESEARCH_CORE",
  "derived_minimum_deployment_class": "A_RESEARCH_CORE",
  "effective_deployment_class": "A_RESEARCH_CORE",
  "operator_legal_entity": "not_applicable",
  "operator_jurisdiction": "not_applicable",
  "authorization_type": "not_applicable",
  "authorization_registry_id": "not_applicable",
  "client_specific": false,
  "instrument_scope": "cashflow_only",
  "alternatives_origin": "user_supplied",
  "ranking_enabled": false,
  "recommendation_language_enabled": false,
  "execution_enabled": false,
  "compensation_model": "none",
  "conflict_policy_id": "not_applicable",
  "suitability_record_id": "not_applicable",
  "human_reviewer_id": "not_applicable",
  "counsel_opinion_id": "not_applicable",
  "retention_policy_id": "not_applicable"
}
